{"project":"_example_test_text","language":"de","fps":25,"resolution":"1920x1080","scenes":[
 {"id":"SC001","act":"hook","narration":"Am 23. April 2005 erschien auf einer gerade erst gestarteten Website ein kurzes Video.","narration_tts":"Am dreiundzwanzigsten April zweitausendfünf erschien auf einer gerade erst gestarteten Website ein kurzes Video.","claim_ids":["C001"],
  "visuals":[{"template":"title_card","params":{"text":"23. April 2005","sub":"Eine neue Website. Ein kurzes Video."}}],"on_screen_source":"S002","music_cue":null,"sfx":[]},
 {"id":"SC002","act":"hook","narration":"Mitgründer Jawed Karim steht darin vor dem Elefantengehege im Zoo von San Diego und sagt nur ein paar Sätze. Dass Elefanten wirklich, wirklich lange Rüssel haben.","claim_ids":["C004"],
  "visuals":[{"template":"broll_generic","params":{"text":"Zoo von San Diego. Elefanten. Ein paar Sätze in die Kamera."}}],"on_screen_source":"S002","music_cue":null,"sfx":[]},
 {"id":"SC003","act":"hook","narration":"Das Video dauert keine zwanzig Sekunden und heißt „Me at the zoo“. Es ist der erste Clip, der jemals auf YouTube veröffentlicht wurde.","claim_ids":["C002","C005"],
  "visuals":[{"template":"title_card","params":{"text":"„Me at the zoo“","sub":"das erste Video auf YouTube"}}],"on_screen_source":"S002","music_cue":null,"sfx":[]},
 {"id":"SC004","act":"setup","narration":"Damals ahnte niemand, was daraus werden würde. Karim und seine Kollegen Chad Hurley und Steve Chen wollten einen einfachen Dienst zum Teilen von Videos bauen.","claim_ids":["C006"],
  "visuals":[{"template":"broll_generic","params":{"text":"Chad Hurley · Steve Chen · Jawed Karim"}}],"on_screen_source":"S002","music_cue":null,"sfx":[]},
 {"id":"SC005","act":"rise","narration":"Doch schon im Herbst 2006 kaufte Google YouTube. Für 1,65 Milliarden Dollar.","narration_tts":"Doch schon im Herbst zweitausendsechs kaufte Google YouTube. Für eins Komma fünfundsechzig Milliarden Dollar.","claim_ids":["C003"],
  "visuals":[{"template":"source_card","params":{"publisher":"Google – Pressemitteilung","title":"Google To Acquire YouTube for $1.65 Billion in Stock","date":"9. Oktober 2006","highlight":"„…for $1.65 billion in a stock-for-stock transaction.“","translation":"„…für 1,65 Milliarden Dollar im Aktientausch.“"},"duration_s":1},
             {"template":"number_callout","params":{"value":"1,65 Mrd. USD","label":"Google kauft YouTube (Oktober 2006)"},"duration_s":1}],"on_screen_source":"S001","music_cue":null,"sfx":[]},
 {"id":"SC006","act":"turn","narration":"Warum so viel? Die Antwort lag nicht in der Technik. Sie lag in den Menschen.","claim_ids":[],
  "visuals":[{"template":"title_card","params":{"text":"Warum so viel?"}}],"on_screen_source":null,"music_cue":null,"sfx":[]},
 {"id":"SC007","act":"turn","narration":"Auf YouTube tauchte zum ersten Mal eine Generation auf, die weder Fernsehen noch Verlag noch Produzenten brauchte. Eine Kamera, eine Idee und Geduld reichten aus. Aus Amateuren wurden Creator, aus Creatorn Unternehmer – und aus Unternehmern ganze Medienmarken.","claim_ids":[],
  "visuals":[{"template":"timeline","params":{"items":[{"date":"Amateur","label":"Kamera und Idee"},{"date":"Creator","label":"festes Publikum"},{"date":"Unternehmer","label":"Einnahmen und Team"},{"date":"Marke","label":"Medienunternehmen"}],"highlight":3}}],"on_screen_source":null,"music_cue":null,"sfx":[]},
 {"id":"SC008","act":"consequence","narration":"Heute nennt man das „Creator Economy“. Doch hinter diesem Begriff steckt etwas viel Menschlicheres: die Geschichten von Leuten, die im Kinderzimmer angefangen haben und innerhalb weniger Jahre Millionen von Zuschauern erreichten. Manche blieben. Andere brannten aus, machten Fehler oder verschwanden genauso schnell, wie sie aufgetaucht waren.","claim_ids":[],
  "visuals":[{"template":"title_card","params":{"text":"„Creator Economy“","sub":"Geschichten von Menschen, nicht nur Zahlen"},"duration_s":1},{"template":"broll_generic","params":{"text":"Manche blieben. Andere brannten aus."},"duration_s":1}],"on_screen_source":null,"music_cue":null,"sfx":[]},
 {"id":"SC009","act":"payoff","narration":"Und genau diese Geschichten interessieren uns. Keine Gerüchte und keine Sensationen, sondern das, was sich belegen lässt. Wie es begann. Was über den Erfolg entschied. Und was geschah, als etwas schiefging.","claim_ids":[],
  "visuals":[{"template":"broll_generic","params":{"text":"Keine Gerüchte. Nur, was sich belegen lässt."}}],"on_screen_source":null,"music_cue":null,"sfx":[]},
 {"id":"SC010","act":"outro","narration":"Denn jeder berühmte Kanal hat seine erste Folge. Und diese erste Folge sieht meistens ganz gewöhnlich aus. Wie zwanzig Sekunden vor einem Elefantengehege.","claim_ids":[],
  "visuals":[{"template":"title_card","params":{"text":"Jeder berühmte Kanal hat seine erste Folge."}}],"on_screen_source":null,"music_cue":null,"sfx":[]}
]}
